,channelTitle,Title,viewCount,likeCount,publishAt,source
0,Crypto Zombie,Someone Is Buying TONS of Bitcoin and It’s NOT Who You Think! The ONE Chart No One is Talking About!,49858,1320,2018-12-12T16:40:31.000Z,Youtube
1,sunny decree,This Man calls the Future of Bitcoin since 2011 like an Oracle!,118408,3154,2018-12-11T14:25:23.000Z,Youtube
2,"TechCashHouse - Best Bitcoin, Crypto, Money News",JOHN MCAFEE’S New OPINION Of BITCOIN WILL BLOW YOUR MIND! Does He KNOW Something HUGE Is COMING?,60760,1268,2018-12-14T00:00:02.000Z,Youtube
3,AMTV,"BITCOIN MILLIONAIRE EXPLAINS MARKET CRASH AND NEXT PRICE TARGET $1,300!!",102504,2055,2018-12-07T22:00:03.000Z,Youtube
4,Bitcoin-Fund-Manager,Bitcoin will SKYROCKET in weeks or Q1 2019,136386,2444,2018-12-07T04:11:46.000Z,Youtube
5,Forflies,The Bitcoin Selloff is About to Get Much Worse: Here's Why... - BTC/CRYPTOCURRENCY TRADING ANALYSIS,59223,899,2018-11-25T15:00:06.000Z,Youtube
6,Louis Thomas,Time Traveller's Prediction for Bitcoin Price 2019,40957,607,2018-12-04T21:49:08.000Z,Youtube
7,BitBoy Crypto,I'm DONE Buying Bitcoin,12156,301,2018-12-07T00:10:42.000Z,Youtube
8,CNBC Television,"Bitcoin is at the end of a distress cycle, says BlockTower",40813,388,2018-11-28T23:42:52.000Z,Youtube
9,Fox Business,Bitcoin on the verge of becoming worthless?,23460,189,2018-12-06T16:08:17.000Z,Youtube
10,CNBC Television,"I am still a long-term bitcoin believer, says the Crypto King",54301,461,2018-11-20T23:29:22.000Z,Youtube
11,"TechCashHouse - Best Bitcoin, Crypto, Money News",“Bitcoin Is ABOUT TO RECOVER In WAY NEVER SEEN For THIS REASON” TOM LEE Shares STARTLING New Secret,20268,459,2018-12-01T00:00:06.000Z,Youtube
12,Cointelegraph,Bitcoin Collapse Explained | Cointelegraph,107189,1486,2018-11-22T22:21:02.000Z,Youtube
13,CNBC Television,"Bitcoin won't have bottomed until 3K flat level, says Genesis Trading's Moro",108567,696,2018-11-23T13:26:40.000Z,Youtube
14,CNBC Television,"Tom Lee cuts bitcoin year-end target to $15,000",131250,950,2018-11-20T13:22:58.000Z,Youtube
15,Crypto Zombie,"Why Bitcoin CANNOT Fall Under $3,000!!! 5 Predictions for $BTC 2019 | MASSIVE $XRP & Crypto Updates!",25749,1122,2018-12-13T18:19:54.000Z,Youtube
16,Altcoin Daily,My Bitcoin Prediction 2019! Lighting Network Update!,26684,1414,2018-12-06T05:30:00.000Z,Youtube
17,The Crypto Sphere,"""Don't Buy Bitcoin - It's Going To Crash!""",8755,215,2018-12-13T06:34:25.000Z,Youtube
18,Mr_Kristof,Bitcoin miners shutting down world wide! Bitmain in trouble.,338395,3598,2018-12-05T21:24:47.000Z,Youtube
19,Crypto Kirby Trading,🚨 Next Bitcoin (BTC) CRASH Begins NOW?! - Crypto Market Trading Analysis & Cryptocurrency News,21809,1148,2018-12-14T02:40:31.000Z,Youtube
20,The Crypto Sphere,"Bitcoin To Crash To $2,000 Then $250,000? Expert Shares His Opinion",25120,520,2018-12-03T04:59:16.000Z,Youtube
21,Alessio Rastani,The Bitcoin Signal NOBODY is Watching Right Now,77431,2953,2018-12-07T11:59:11.000Z,Youtube
22,The Modern Investor,"Bitcoin Tumbles In Price, Set To Go Lower - What Is Happening To Crypto Markets?",34887,1082,2018-11-25T09:46:28.000Z,Youtube
23,Cointelegraph,Time To Buy Bitcoin?,137337,2576,2018-12-02T01:55:39.000Z,Youtube
24,Crypto Jebb,"If You're Considering Leaving Bitcoin, Watch This Video.",19940,582,2018-11-27T16:28:39.000Z,Youtube
25,Altcoin Daily,Can Bitcoin Reach $1 Million by 2020? -Realistically,27711,942,2018-11-11T14:00:04.000Z,Youtube
26,Altcoin Daily,URGENT: Bitcoin Crashing! SHOULD I SELL? [Cryptocurrency Perspective],36441,1340,2018-11-20T11:00:08.000Z,Youtube
27,Altcoin Daily,Warning: I Think Bitcoin Is Going Under 3K...Here Is Why? [Altcoins I Bought],37328,2119,2018-11-25T12:00:01.000Z,Youtube
28,"TechCashHouse - Best Bitcoin, Crypto, Money News",Is THIS DEFINITIVE PROOF That BITCOIN WILL MOON In 2019? This TOM LEE ANALYSIS Will BLOW YOUR MIND,6020,198,2018-12-13T05:00:02.000Z,Youtube
29,Bloomberg Markets and Finance,"Future of Crypto Is Brighter Than Ever, Says Bitcoin.com's Ver",12334,148,2018-12-04T08:15:26.000Z,Youtube
30,"TechCashHouse - Best Bitcoin, Crypto, Money News",Tom Lee’s NEW OPINION OF BITCOIN May BLOW YOUR MIND - This VIDEO IS A MUCH WATCH For BTC Investors,19283,557,2018-12-12T00:00:02.000Z,Youtube
31,The Crypto Lark,"Bitcoin Whale $250,000,000 Moved - Price Tsunami Coming?",15838,1054,2018-12-04T04:06:19.000Z,Youtube
32,Alessio Rastani,How Low Will Bitcoin Go?,65150,2891,2018-11-18T17:09:25.000Z,Youtube
33,Alessio Rastani,Is the Drop in Bitcoin Really A False Breakout?,54805,2761,2018-11-19T14:14:02.000Z,Youtube
34,CNBC Television,Bitcoin down almost 80 percent since 2017 peak,22842,201,2018-11-27T12:18:06.000Z,Youtube
35,Louis Thomas,My Next Target Bitcoin Buy-In Price,24288,844,2018-12-09T22:21:20.000Z,Youtube
36,Crypto365,John McAfee drop Bitcoin Price Predictions that may shock you,110440,1551,2018-08-29T12:05:44.000Z,Youtube
37,Alessio Rastani,Bitcoin Breaks the Floor... How Bad is This?,60472,2520,2018-11-15T18:30:36.000Z,Youtube
38,The Moon,Bitcoin Breaking Out! But Is It Really That Bullish? | Winklevoss App Launch!,15271,517,2018-12-12T12:34:53.000Z,Youtube
39,Crypto Daily,An Important Message to All Bitcoin HODLers!,74405,4622,2018-11-23T17:18:29.000Z,Youtube
40,Crypto Daily,This Bitcoin War Has Only Just Begun...,36154,1941,2018-11-16T15:37:54.000Z,Youtube
41,Crypto Crew University,Attention: MAJOR Bitcoin Move Setting Up Right Now (Bitcoin Crash News),39401,2201,2018-12-10T22:31:49.000Z,Youtube
42,CNBC Television,"Long, dark winter ahead for crypto, says bitcoin oracle Vinny Lingham",19988,162,2018-11-26T23:13:34.000Z,Youtube
43,Crypto Jebb,If You're In Bitcoin For This Reason You May As Well Leave,6647,249,2018-12-11T15:58:23.000Z,Youtube
44,The Moon,"Bitcoin To $3,000 & When Bounce?? | Coinbase Adds New Coins!! | Short Squeeze Coming?",13371,585,2018-12-08T11:55:17.000Z,Youtube
45,Forflies,A SCARY REALITY OF BITCOIN THAT NO ONE WANTS TO TALK ABOUT... - BTC/CRYPTOCURRENCY TRADING ANALYSIS,22642,367,2018-11-27T22:09:04.000Z,Youtube
46,CryptosRUs,Bitcoin and Crypto Market CRASH - Will History Repeat on Nov 15th?,31726,986,2018-11-14T17:56:44.000Z,Youtube
47,Louis Thomas,My Target Bitcoin Buy-In Price,35030,757,2018-11-19T17:24:04.000Z,Youtube
48,Kevin Svenson,Bitcoin Hitting New Lows! 🔴 LIVE | Crypto | Bitcoin,6560,329,2018-12-07T04:54:28.000Z,Youtube
49,CNBC Television,"Bitcoin will end down at 85 percent of previous highs, says expert",12573,135,2018-11-26T13:39:21.000Z,Youtube
